index,published,keyword,domain,language,valid,title,description,url,image,archive,content,quote,de,en,la,added
d4e2b0b7f792a136437feabccb2a6c86,2026-06-04T07:15:00Z,'Landwirtschaft Klimawandel',www.telepolis.de,de,0.9,Frankreich in der Hitzefalle: Wenn der Klimawandel die Wirtschaft trifft,"Rekordtemperaturen im Mai belasten Atomkraft, Landwirtschaft und Bauwirtschaft. Die Zentralbank warnt vor schweren wirtschaftlichen Folgen.",https://www.telepolis.de/article/Frankreich-in-der-Hitzefalle-Wenn-der-Klimawandel-die-Wirtschaft-trifft-11317777.html,https://heise.cloudimg.io/bound/1200x1200/q85.png-lossy-85.webp-lossy-85.foil1/_www-heise-de_/imgs/18/5/0/9/4/4/7/7/Master_Frankreich-40c4b1edc9601143.jpg,,"Foto: Shutterstock.com
Rekordtemperaturen im Mai belasten Atomkraft, Landwirtschaft und Bauwirtschaft. Die Zentralbank warnt vor schweren wirtschaftlichen Folgen.
Dass Frankreich stärker als andere… [+5574 chars]",,"Frankreich in der Hitzefalle: Wenn der Klimawandel die Wirtschaft trifft. Rekordtemperaturen im Mai belasten Atomkraft, Landwirtschaft und Bauwirtschaft. Die Zentralbank warnt vor schweren wirtschaftlichen Folgen.","France in the heat trap: When climate change hits the economy. Record temperatures in May are putting a strain on nuclear power, agriculture and the construction industry. The central bank warns of serious economic consequences.","Gallia in laqueis caloris: Cum mutatio climatis oeconomiam pervenit. Record temperaturas mense Maio iactant vim nuclearem, agriculturam et industriam constructionis. Argentaria centralis monet graves consectariis oeconomicis.",2026-06-09 17:21:54+00:00
110cb0c745f930f3ee595daf7cbe7816,2026-06-04T13:44:16Z,'Klimawandel',www.diepresse.com,de,0.9,Warum echter Honig nie gleich schmecken sollte [premium],"Je nach Wetter, Blüte und Landschaft verändert sich das Aroma von Honig jedes Jahr aufs Neue – mittlerweile spielt hier sogar der Klimawandel mit.",https://www.diepresse.com/27282508/warum-echter-honig-nie-gleich-schmecken-sollte,https://img.diepresse.com/public/incoming/vu6fnz-2271376338/alternates/WEBP_WIDE_1200/2271376338,http://web.archive.org/web/20260605093821/https://www.diepresse.com/27282508/warum-echter-honig-nie-gleich-schmecken-sollte,"Guter Honig hinterlässt am Gaumen ein cremiges Gefühl und sollte auch im Abgang nicht sauer werden. Schmeckt er gärig eine typische Fehlnote , dann wurde er falsch und zu feucht geerntet. Der Rest is… [+7506 chars]",,"Warum echter Honig nie gleich schmecken sollte [premium]. Je nach Wetter, Blüte und Landschaft verändert sich das Aroma von Honig jedes Jahr aufs Neue – mittlerweile spielt hier sogar der Klimawandel mit.","Why real honey should never taste the same [premium]. Depending on the weather, flowers and landscape, the aroma of honey changes every year - climate change is now even playing a role here.","Quare verum mel numquam idem gustare debet. Secundum tempestatem, florum et landscape, odor mellis quotannis mutat - mutatio climatis nunc etiam munus hic agit.",2026-06-09 17:21:54+00:00
bfafab621feafa92359bc7c85db66a45,2026-06-08T15:20:49Z,'Landwirtschaft Klimawandel',www.tagesschau.de,de,0.9,Wie weniger Wasserverbrauch in der Landwirtschaft mehr Ertrag bringen kann,Durch den Klimawandel gibt es mehr Trockenperioden mit Wassermangel. Dies ist auch für die Landwirtschaft ein Problem. Doch durch sparsame Bewässerungstechniken lässt sich Wasser sparen - und der Ertrag steigern. Von S. Henn.,https://www.tagesschau.de/wissen/klima/bewaesserung-landwirtschaft-102.html,https://images.tagesschau.de/image/59c32b74-5848-4bdf-a6e0-572a0d8e4dfe/AAABnqeFCpU/AAABnSSvrFg/16x9-big/wasser-feld-100.jpg?width=1280,,"Stand: 08.06.2026 17:20 Uhr
Durch den Klimawandel gibt es mehr Trockenperioden mit Wassermangel. Dies ist auch für die Landwirtschaft ein Problem. Doch durch sparsame Bewässerungstechniken lässt sic… [+4808 chars]",,Wie weniger Wasserverbrauch in der Landwirtschaft mehr Ertrag bringen kann. Durch den Klimawandel gibt es mehr Trockenperioden mit Wassermangel. Dies ist auch für die Landwirtschaft ein Problem. Doch durch sparsame Bewässerungstechniken lässt sich Wasser sparen - und der Ertrag steigern. Von S. Henn.,"How less water consumption in agriculture can bring more yield. Climate change is causing more dry periods with water shortages. This is also a problem for agriculture. But through economical irrigation techniques, water can be saved - and yields increased. By S. Henn.","Quo minus aquae consumptio in agricultura plus cedat. Mutatio climatis causat periodos magis siccas cum aquarum inopias. Haec quoque quaestio agriculturae est. Sed per technicas oeconomicas irrigationes, aqua salvari potest - et cedit augeri. Apud S. Henn.",2026-06-09 17:21:54+00:00
